{"evidence_boundary":"Synthetic deterministic point-mass coordination replay with linear moving keep-out spheres over abstract links; read-only output does not establish measured radio tolerance, tracking tolerance, flight performance, safety, or live control.","frames":[{"active_count":1,"agents":[{"active":true,"agent_id":"drone-001","constraint_flags":["moving-wall"],"fused_target_m":[0.0,0.0,1.5],"min_neighbor_distance_m":null,"neighbor_count":0,"position_m":[2.5,0.0,1.5],"profile_id":"drone-001-synthetic-profile","target_age_s":0.0,"target_estimate_m":[0.0,0.0,1.5],"target_source_time_s":0.0,"velocity_mps":[2.0,0.0,0.0]}],"keep_out_spheres":[{"center_m":[2.0,0.0,1.5],"label":"moving-wall","radius_m":0.5}],"step_index":0,"target_position_m":[0.0,0.0,1.5],"time_s":0.0},{"active_count":1,"agents":[{"active":true,"agent_id":"drone-001","constraint_flags":[],"fused_target_m":[0.0,0.0,1.5],"min_neighbor_distance_m":null,"neighbor_count":0,"position_m":[2.59225,0.0,1.5],"profile_id":"drone-001-synthetic-profile","target_age_s":0.0,"target_estimate_m":[0.0,0.0,1.5],"target_source_time_s":0.05,"velocity_mps":[1.8449999999999989,0.0,0.0]}],"keep_out_spheres":[{"center_m":[2.025,0.0,1.5],"label":"moving-wall","radius_m":0.5}],"step_index":1,"target_position_m":[0.0,0.0,1.5],"time_s":0.05},{"active_count":1,"agents":[{"active":true,"agent_id":"drone-001","constraint_flags":[],"fused_target_m":[0.0,0.0,1.5],"min_neighbor_distance_m":null,"neighbor_count":0,"position_m":[2.676761125,0.0,1.5],"profile_id":"drone-001-synthetic-profile","target_age_s":0.0,"target_estimate_m":[0.0,0.0,1.5],"target_source_time_s":0.1,"velocity_mps":[1.6902225000000026,0.0,0.0]}],"keep_out_spheres":[{"center_m":[2.05,0.0,1.5],"label":"moving-wall","radius_m":0.5}],"step_index":2,"target_position_m":[0.0,0.0,1.5],"time_s":0.1}],"link_events":[{"duplicate":false,"loss_reason":null,"out_of_order":false,"outcome":"received","packet_age":0.0,"receive_time":0.0,"receiver":"drone-001","send_time":0.0,"sender":"__target__","seq":0},{"duplicate":false,"loss_reason":null,"out_of_order":false,"outcome":"received","packet_age":0.0,"receive_time":0.05,"receiver":"drone-001","send_time":0.05,"sender":"__target__","seq":1},{"duplicate":false,"loss_reason":null,"out_of_order":false,"outcome":"received","packet_age":0.0,"receive_time":0.1,"receiver":"drone-001","send_time":0.1,"sender":"__target__","seq":2}],"parameters":{"agent_count":1,"altitude_m":1.5,"dt_s":0.05,"keep_out_spheres":[{"center_m":[2.0,0.0,1.5],"label":"moving-wall","radius_m":0.5,"velocity_mps":[0.5,0.0,0.0]}],"neighbor_link":{"burst_end_probability":1.0,"burst_start_probability":0.0,"contention_mode":"none","delay_jitter_s":0.0,"delay_s":0.0,"loss_model":"none","loss_probability":0.0,"packet_duration_s":0.0},"radius_m":2.0,"scenario_id":"s7-moving-example","seed":7,"steps":3,"target_link":{"burst_end_probability":1.0,"burst_start_probability":0.0,"contention_mode":"none","delay_jitter_s":0.0,"delay_s":0.0,"loss_model":"none","loss_probability":0.0,"packet_duration_s":0.0},"target_velocity_mps":[0.0,0.0,0.0]},"parameters_canonical":"{\"agent_count\":1,\"altitude_m\":1.5,\"dt_s\":0.05,\"keep_out_spheres\":[{\"center_m\":[2.0,0.0,1.5],\"label\":\"moving-wall\",\"radius_m\":0.5,\"velocity_mps\":[0.5,0.0,0.0]}],\"neighbor_link\":{\"burst_end_probability\":1.0,\"burst_start_probability\":0.0,\"contention_mode\":\"none\",\"delay_jitter_s\":0.0,\"delay_s\":0.0,\"loss_model\":\"none\",\"loss_probability\":0.0,\"packet_duration_s\":0.0},\"radius_m\":2.0,\"scenario_id\":\"s7-moving-example\",\"seed\":7,\"steps\":3,\"target_link\":{\"burst_end_probability\":1.0,\"burst_start_probability\":0.0,\"contention_mode\":\"none\",\"delay_jitter_s\":0.0,\"delay_s\":0.0,\"loss_model\":\"none\",\"loss_probability\":0.0,\"packet_duration_s\":0.0},\"target_velocity_mps\":[0.0,0.0,0.0]}\n","payload_canonical":"{\"frames\":[{\"active_count\":1,\"agents\":[{\"active\":true,\"agent_id\":\"drone-001\",\"constraint_flags\":[\"moving-wall\"],\"fused_target_m\":[0.0,0.0,1.5],\"min_neighbor_distance_m\":null,\"neighbor_count\":0,\"position_m\":[2.5,0.0,1.5],\"profile_id\":\"drone-001-synthetic-profile\",\"target_age_s\":0.0,\"target_estimate_m\":[0.0,0.0,1.5],\"target_source_time_s\":0.0,\"velocity_mps\":[2.0,0.0,0.0]}],\"keep_out_spheres\":[{\"center_m\":[2.0,0.0,1.5],\"label\":\"moving-wall\",\"radius_m\":0.5}],\"step_index\":0,\"target_position_m\":[0.0,0.0,1.5],\"time_s\":0.0},{\"active_count\":1,\"agents\":[{\"active\":true,\"agent_id\":\"drone-001\",\"constraint_flags\":[],\"fused_target_m\":[0.0,0.0,1.5],\"min_neighbor_distance_m\":null,\"neighbor_count\":0,\"position_m\":[2.59225,0.0,1.5],\"profile_id\":\"drone-001-synthetic-profile\",\"target_age_s\":0.0,\"target_estimate_m\":[0.0,0.0,1.5],\"target_source_time_s\":0.05,\"velocity_mps\":[1.8449999999999989,0.0,0.0]}],\"keep_out_spheres\":[{\"center_m\":[2.025,0.0,1.5],\"label\":\"moving-wall\",\"radius_m\":0.5}],\"step_index\":1,\"target_position_m\":[0.0,0.0,1.5],\"time_s\":0.05},{\"active_count\":1,\"agents\":[{\"active\":true,\"agent_id\":\"drone-001\",\"constraint_flags\":[],\"fused_target_m\":[0.0,0.0,1.5],\"min_neighbor_distance_m\":null,\"neighbor_count\":0,\"position_m\":[2.676761125,0.0,1.5],\"profile_id\":\"drone-001-synthetic-profile\",\"target_age_s\":0.0,\"target_estimate_m\":[0.0,0.0,1.5],\"target_source_time_s\":0.1,\"velocity_mps\":[1.6902225000000026,0.0,0.0]}],\"keep_out_spheres\":[{\"center_m\":[2.05,0.0,1.5],\"label\":\"moving-wall\",\"radius_m\":0.5}],\"step_index\":2,\"target_position_m\":[0.0,0.0,1.5],\"time_s\":0.1}],\"link_events\":[{\"duplicate\":false,\"loss_reason\":null,\"out_of_order\":false,\"outcome\":\"received\",\"packet_age\":0.0,\"receive_time\":0.0,\"receiver\":\"drone-001\",\"send_time\":0.0,\"sender\":\"__target__\",\"seq\":0},{\"duplicate\":false,\"loss_reason\":null,\"out_of_order\":false,\"outcome\":\"received\",\"packet_age\":0.0,\"receive_time\":0.05,\"receiver\":\"drone-001\",\"send_time\":0.05,\"sender\":\"__target__\",\"seq\":1},{\"duplicate\":false,\"loss_reason\":null,\"out_of_order\":false,\"outcome\":\"received\",\"packet_age\":0.0,\"receive_time\":0.1,\"receiver\":\"drone-001\",\"send_time\":0.1,\"sender\":\"__target__\",\"seq\":2}],\"profiles\":[{\"arm_length_m\":0.1,\"battery_capacity_wh\":5.0,\"calibration_id\":null,\"code_revision\":null,\"estimated_max_thrust_n\":7.134971975266999,\"estimated_thrust_at_rpm_limit_n\":7.134971975266999,\"frame_mass_kg\":0.03,\"motor\":{\"mass_kg\":0.01,\"max_power_w\":18.72,\"max_rpm\":39520.0,\"max_torque_nm\":0.001872,\"nominal_voltage_v\":3.7,\"part_id\":\"drone-001-motor\"},\"motor_count\":4,\"notes\":null,\"profile_id\":\"drone-001-synthetic-profile\",\"propeller\":{\"diameter_m\":0.0782,\"mass_kg\":0.002,\"max_rpm\":37440.0,\"part_id\":\"drone-001-prop\",\"pitch_m\":0.039,\"power_coefficient\":0.04,\"thrust_coefficient\":0.1},\"source\":null,\"status\":\"synthetic\",\"total_mass_kg\":0.078}]}\n","payload_sha256":"6c9a22bcc55b5c5ee2c3a17df5db59cadc8294055944e2b48ad2ff7e3d9a63f4","profiles":[{"arm_length_m":0.1,"battery_capacity_wh":5.0,"calibration_id":null,"code_revision":null,"estimated_max_thrust_n":7.134971975266999,"estimated_thrust_at_rpm_limit_n":7.134971975266999,"frame_mass_kg":0.03,"motor":{"mass_kg":0.01,"max_power_w":18.72,"max_rpm":39520.0,"max_torque_nm":0.001872,"nominal_voltage_v":3.7,"part_id":"drone-001-motor"},"motor_count":4,"notes":null,"profile_id":"drone-001-synthetic-profile","propeller":{"diameter_m":0.0782,"mass_kg":0.002,"max_rpm":37440.0,"part_id":"drone-001-prop","pitch_m":0.039,"power_coefficient":0.04,"thrust_coefficient":0.1},"source":null,"status":"synthetic","total_mass_kg":0.078}],"provenance":{"code_revision":"test","dt_s":0.05,"generator":"sim.scenario_runner","numpy":"2.5.1","python":"3.13.15","seed":7,"status":"synthetic deterministic replay; read-only"},"scenario_hash":"5ace5a9e8303df38a4b88128be54983f22cba764ea2c11708f873aabf55c0022","schema":"zephyr-s7-scenario-run-1","version":1}
